{
  "skill_name": "process_refund_request",
  "version": 1,
  "trigger": "customer_requests_refund",
  "inputs": [
    {"name": "refund_amount", "type": "number"},
    {"name": "purchase_days_ago", "type": "integer"},
    {"name": "customer_segment", "type": "string"},
    {"name": "fraud_flags", "type": "array"},
    {"name": "refund_reason", "type": "string"}
  ],
  "decision_zones": {
    "deterministic": [
      {
        "condition": {
          "all": [
            {"field": "refund_amount", "op": "lte", "value": 100.0},
            {"field": "purchase_days_ago", "op": "lte", "value": 30},
            {"field": "fraud_flags", "op": "empty", "value": null}
          ]
        },
        "action": "approve_refund",
        "citation": {
          "span": {"start": 15, "end": 113},
          "quoted_text": "Refunds of $100 or less are approved when requested within 30 days and no fraud flags are present."
        }
      },
      {
        "condition": {
          "all": [
            {"field": "refund_amount", "op": "gt", "value": 500.0}
          ]
        },
        "action": "escalate_to_finance",
        "citation": {
          "span": {"start": 115, "end": 162},
          "quoted_text": "Refunds over $500 must be escalated to Finance."
        }
      }
    ],
    "llm_assisted": [
      {
        "condition": {
          "all": [
            {"field": "refund_reason", "op": "contains", "value": "goodwill"}
          ]
        },
        "action": "draft_recommendation",
        "requires_human_approval": true,
        "citation": {
          "span": {"start": 164, "end": 234},
          "quoted_text": "Goodwill requests require a drafted recommendation and human approval."
        }
      }
    ],
    "human_only": [
      {
        "condition": {
          "all": [
            {"field": "fraud_flags", "op": "not_empty", "value": null}
          ]
        },
        "action": "escalate_to_fraud_team",
        "citation": {
          "span": {"start": 236, "end": 297},
          "quoted_text": "Tickets with fraud flags must be escalated to the fraud team."
        }
      }
    ]
  }
}
